number;title;measurements;description;condition
144;Bronzeskulptur;d. 180 cm, H 260 cm;Kegelförmige Skulptur, die aus rechteckigen Stahlplatten „zusammengesetzt“ ist. Die Platten sind lückenhaft neben- und übereinander gesetzt und werden nach oben kleiner. Das Objekt war bis in die erste Hälfte der 1990er Jahre auf dem Museumsberg aufgestellt. Nach Angaben von Bernd Köster, dem damaligen Leiter des Hochbauamtes, war es möglicherweise die Arbeit einer Schülerin oder eines Schülers der Werkkunstschule. Auf Bitte des damaligen Museumsdirektors Ulrich Schulte-Wülwer wurde des vom Museumsberg entfernt.;, Stand 10.2015: Starke Rostspuren und Grünbelag. Kratzer, Beulen und kleine Farbspuren. Innen Grünbewuchs.
146;Geometrische Skulptur;d. ca. 250 cm, H ca. 230 cm;Geometrisches, trapezformähnliches Gerüst aus Stahl, in sich etwas gedreht und blau bemalt. Ursprünglich war eine Tafel mit dem Logo und dem Namen der Schule an der Vorderseite zwischen vier Stahlbalken angebracht.;, Stand 10.2015: Starker Grünbelag, Rostflecken, Farbabrieb und Schmutz
150;Seepferdchenbrunnen;Skulptur 80x12 cm, H 100 cm, Stein: H ca.140 cm;Ein aus Metall geformtes Seepferdchen, ist auf einen roten großen Granitstein montiert. Durch ein Loch in der Mitte des Steines kommt eine Wasserfontäne und schießt durch das Seepferdchen ca. 1m in die Höhe. Der Stein und ein weiterer kleinerer Stein stehen in einem Becken aus in Beton gegossenen kleinen Felssteinen. Das Becken hat einen Ablauf, der ebenfalls aus in Beton gegossenen kleinen Felssteinen besteht und in den Teich führt. Das Seepferdchen schaut in Richtung Teich. Auf dem Granitstein ist rechts unten ein Spaten und ein „B“ eingemeißelt, evtl. noch ein anderes Zeichen. Die Quelle liegt in 280 cm Tiefe, das Wasser wird ohne Pumpe nach oben gepresst (laut Information eines Bürgers).;, Stand 10.2015: Skulptur, Stein und Becken weisen starken Grünbelag und Flechten auf. Auf der Skulptur sind Rostflecken. Das Becken ist voller Laub.
155;3 weibliche Betonfiguren;1. B 103x T 66 cm, H 90 cm, 2. 86x170 cm, H 60 cm, 3. 90x120 cm, H 100 cm;3 weibliche einzelne Figuren, die im Gras sitzen. 1. Sitzende mit ausgestrecktem linken Bein, Arme vor der Brust gekreuzt, Gesicht ist nicht ausgearbeitet. 2. Auf Knien und Unteramen gestützte, dünne Figur. Der Kopf ist auf die Arme gelegt, mit dem Gesicht nach unten. Die Wirbelsäule tritt deutlich hervor. 3. Sitzende, etwas fülligere Figur, die Beine vor dem Körper angezogen, die linke Hand auf den Oberschenkel gelegt, Augen, Nase, Mund sind ausgearbeitet. 146 Kunstkataster der Stadt Flensburg – Objekte im städtischen Eigentum;, Stand 10.2015: 1. Kittstellen platzen ab. Bei 1. und 3. Skulptur leichte Farbreste von Graffiti. An allen starker Grünbelag, Flechtenbewuchs. Kleine Risse im Beton. Gras sollte um die Skulpturen herum entfernt werden.
156;Kunst am Bau, Wandmosaik;B ca. 400 cm, H ca. 250 cm;An der weiß verputzten Fassade der Schule ist ein Wandmosaik aus verschiedenen Steinarten bzw. Fliesen angebracht. Es formt 5 Rinder/Kühe in einem Feld, darüber sind diagonal 2 Gleise als Mosaik gestaltet. Unter dem Mosaik ist eine einzelne Kachel mit dem Relief „18/64“ angebracht. Verweis auf Herstellungsjahr des Mosaiks 1964?;, Stand 10.2015: Sehr gut.
159;Schaufenster-Installation Stadtbibiliothek;ca. 220x195 cm insgesamt;12 nebeneinander stehende einzelne Buchrücken aus Holz, in verschiedenen Farben füllen das Schaufenster aus. Der Titel des Buches ist aufgemalt. U.a. Gertrude Stein „Picasso“, Elsbeth Arlt „Die Bibliothek nebenan“, „Gartenfreuden“.;, Stand 10.2015: Sehr gut. Kleine Kratzer. An einem Buch ist die Farbschicht gerissen. Sonstiges: Auftrag der Stadtbibliothek an Künstlerin. Infos siehe http://www.gestaltung-und-holz.de/
181;4 Granitsteine mit Wappen und Inschriften;je 37x40 cm, H 48 cm;Vier kleine Granitsteine, trapezförmig behauen mit je einem eingemeißelten Wappen und darüber der Ortsname von Tondern, Apenrade, Sonderburg, Hadersleben. Die aufgestellten Steine begrenzen die Betonplattform eines Turmes. Die Steine waren ursprünglich Schlusssteine von Fenstern des Gebäudes Apenrader Straße 111, errichtet 1938 als HJ-Heim durch den Kieler Architekten Otto Christophersen, zuletzt JAW Apenrader Straße, abgebrochen 2011 für einen Aldi-Markt..;, Stand 10.2015: Etwas Grünbelag, starker Schmutzbelag an den Vorderseiten, z.T. abgestoßen.
182;Tor, Eingang zum Schulhof, Kunst am Bau?;L ca. 850 cm, H 163 cm;Geometrisch gestaltetes Tor zum Schulhof mit 4 Türen. Das Tor hat senkrechte runde Stäbe, die versetzt stehen und so dem Tor Tiefe geben. Zwischen den Stäben sitzen rechteckige Eisen-Flächen mit einem quadratischen ausgeschnittenen Loch. Auch die Schlösser mit Griffen und die Feststellhaken der Tore sind rechteckig geformt mit Würfel an den Enden der Griffe. An den oberen Querriegeln der vier Tore sind vier Inschriften eingeritzt „A. Schmidt- Trappenkamp 1982“ Wahrscheinlich beim Bau der Schule errichtet, evtl. als Kunst am Bau? 154 Kunstkataster der Stadt Flensburg – Objekte im städtischen Eigentum;, Stand 10.2015: Gut. Vereinzelte Roststellen.
184;Skulptur Ritter;110x50 cm, H 251 cm;Figur mit Helm, Schwert, Speer, Axt und Umhang aus einzelnen Stahlplatten, die mit Stegen verlötet und verbunden wurden, so dass die Figur aus mehreren Schichten besteht. Auf der Vorderseite auf dem rechten Schild Stempel „Arch. Lo 18.08.04“. Die Plastik soll an die Zeit von Kong Arrild erinnern und auf den nahen Jütland-Heerweg Bezug nehmen. Bei der Ausgestaltung der Plastik wurde Architekt Lorenzen vom Archäologen Dr. Zich beraten. Die Ausführung erfolgte durch die Fa. Ideen in Metall, Herrn Hans und Herrn Wieland.;, Stand 10.2015: Die Rostpatina weist viele Kratzer auf, Graffiti, Vogelkot, etwas Grünbelag. Die Füße sind vom Gras zugewachsen.
195;Wasserspiel: Zeus, Pan und Schilfrohr;;Errichtet von der Landesbauverwaltung (heute GMSH).Dreiteilige Granitskulptur, als Brunnenanlage gestaltet. 158 Kunstkataster der Stadt Flensburg – Objekte im städtischen Eigentum;
204;Klassizistische Stuckdecke;;Aufwändige klassizistische Stuckdecke aus dem Gartensaal des Querspeichers Holm 19/21. Das Gebäude wurde in den 1930er Jahren abgebrochen, die Stuckdecke wurde in Teilen ausgebaut und vom Museum in Verwahrung genommen. Bei der Dachsanierung des Heinrich-Sauermann-Hauses um 2001 wurden die Teile ausgelagert, zunächst in der Pumpstation Ballastbrücke. Da der Raum anderweitig benötigt wurde, wurden die Teile 2011 an einen anderen Ort verbracht. Der Ort konnte nicht festgestellt werden. Da es sich um ein für die 159 Kunstkataster der Stadt Flensburg – Objekte im städtischen Eigentum Flensburger Kunstgeschichte wichtiges Werk handelt, ist eine Wiederauffindung und Wiederverwendung sehr wünschenswert.;, Stand 10.2015: Aufbewahrungsort zurzeit unbekannt.
208;Bronzeplastik „Murmelspielerin“;;Bronzeplastik auf Granitsockel, ein Mädchen darstellend, das mit einer Murmel spielt. 161 Kunstkataster der Stadt Flensburg – Objekte im städtischen Eigentum;
209;Fassadenmosaik „Rotes Tor“;;Mosaik aus keramischen Platten. Dargestellt ist das Rote Tor, vor dem der heutige Stadtteil Rude lag.;
