number;title;measurements;description;condition
55;„Pylone“ Stelen;104-112x116-120 cm, H 530 cm;2 rechteckige Stelen aus rötlichem Granit stehen nebeneinander und sind an einer Ecke zueinander gewandt. In der Mitte sind Rundungen eines menschlichen Körpers eingemeißelt, damit man hindurch gehen kann (U. Appold). Die Oberfläche der Stelen weist waagerechte breite und schmale Kerben auf. Der Blick durch die Stelen geht auf die Schulhofmitte zu den Skulpturen des 1. Bauabschnitts (Nr. 58);, Stand 10.2015: Flechten im oberen Bereich, geringer Grün- und Schmutzbelag, kleine blaue Farbkleckse in der Mitte am Durchgang.
56;Tisch;1. 260x190 cm, H 98 cm, 2. 196x186 H 112 cm, 12 Tonnen Gesamtgewicht;Zweiteiliger, zerbrochener Tisch auf kleiner Anhöhe im Grünen, von Bäumen umgeben. Die 2 Tischplatten sind aus Granit und stehen auf je 4 Betonsockeln. Allseitig hat der Granit Rillenspuren. Die Blöcke wurden im Steinbruch durch Ablochen/Bohren auf Maß gebracht. Die Oberflächen sind mit Flammen um 1200 Grad behandelt, so dass alle rauen Teile abplatzten. Keine Verletzungsgefahr. 76 Kunstkataster der Stadt Flensburg – Objekte im städtischen Eigentum;, Stand 10.2015: Starker Moos- und Grünbelag, Vogelkot, Müll, Asche auf dem Stein. Baumbewuchs direkt neben dem Objekt, Grünbewuchs. Reinigung und Entfernung des Baum-, Grünbewuchses notwendig.
57;Bronzeskulptur „Gruppenverhalten“;116x62 cm H 155 cm;Ein tischartiger Sockel steht auf 4 runden kurzen Beinen. Auf dem Tisch sind 4x4 aus geometrischen (Kugel-Zylinder-Scheibe) Formen bestehende Figuren platziert. Diesen gegenüber steht eine einzelne Figur. Laut Homepage des Künstlers heißt die Arbeit „Gruppenverhalten“. Die Signatur „ENGST 82“ ist auf der Tischplatte angebracht. Die Arbeitsspuren sind sichtbar gelassen. Die Skulptur ist auf einer großen Betonplatte auf den Schulhof angebracht. 78 Kunstkataster der Stadt Flensburg – Objekte im städtischen Eigentum;, Stand 10.2015: Oberseite mit kleinen Flechten. Z.T. Patina, sonst sehr guter Zustand. Vor der Signatur ist der Buchstabe H eingekratzt. Die einzelne Figur ist leicht schief.
59;Kunst am Bau, Schildkröten-Relief;L 490 cm, T ca. 95 cm, H ca. 223 cm;2 Betonwände stehen als Trennung zwischen dem Parkplatz und dem Eingang der Kita und sind hintereinander versetzt gestellt. Die hintere Wand hat eine gerundete, wellenförmige Oberkante und zwei ovale große Löcher. Eine Schildkröte aus Kupferblech liegt auf der Wandecke und lässt ihre Beine herabhängen. An der Betonwand (Seite zum Eingang) ist ein Relief angebracht mit einer Schnecke, Muscheln und einer kleinen Schildkröte. An der vorderen Wand ist ebenfalls ein Kupferblechrelief angebracht, was Muscheln, Algen und einen Krebs zeigt. Die Wand hat ein großes ovales Loch. Unten rechts sind der Name der Künstlerin und das Jahr der Entstehung angegeben. 80 Kunstkataster der Stadt Flensburg – Objekte im städtischen Eigentum;, Stand 10.2015: Hinteres Relief: Rostflecken, Kratzer, Schmutz und Abrieb. Vorderes Relief: Eine Schraubhalterung fehlt, so dass Relief oben rechts nicht mehr mit der Wand verbunden ist. Kratzer, Abrieb, Schmutzbelag. An beiden Wänden Graffiti, starker Grünbelag und Flechtenbewuchs sowie Rostflecken.
60;Wurm oder Schlange Skulptur;180x30 cm, H ca. 84 cm;Wurm oder schlangenartiges Wesen mit offenem Mund (frisst Sand), aufgesetzten runden Augen, geschwungenem Körper und eingerolltem Schwanz. Die Skulptur ist in die Mitte einer Sandkiste auf kleinen Granitsockel montiert. Starke Ähnlichkeit mit der „Holmnixe“ von U. Beier (Nr. 7);, Stand 10.2015: Leichter Grünbelag, an Oberseite starke Abnutzung, Fehlstellen vom Spielen der Kinder.
61;Kunst am Bau, Wasserspiel mit Drachen-Skulptur;L 210 cm, d. 40 cm;Im Lichthof der Kita ist ein Teich angelegt mit einem Wasserspiel in Form eines Drachen. Ein Plastikrohr fungiert als Körper und ist mit einem Metallgerüst und einem Seil befestigt. Aus Metall oder Plastik sind Zähne und eine Zunge aus rotem Gummi im Rohr geformt. Kleine Ohren aus rotem Gummi sind an der Oberseite des Rohres angebracht. Durch eine Pumpe wird Wasser aus dem Teich zurück in einen Schlauch an der Skulptur geführt, so dass der Drache nach einer Zeitschaltuhr Wasser spuckt. 84 Kunstkataster der Stadt Flensburg – Objekte im städtischen Eigentum;, Stand 10.2015: Ehemals kam das Wasser in einem großen Schwall heraus. Durch Reduzierung des Drucks und Bohren eines kleinen Loches im Rachen des Drachen ist es nun ein kleiner Wasserlauf (Reduzierung des Wasserverbrauchs?). Starker Moos-, Grün- und Schmutzbelag. Ursprüngliche Farbgebung nicht mehr zu sehen. Reinigung ist dringend notwendig.
62;Wasserwand;L ca. 3200 cm, H ca. 304 cm;Wand aus vier Lagen einzelnen Granitplatten, die versetzt und unterschiedlich hoch hintereinander stehen. Am rechten Ende sind die Granitplatten versetzt gestellt, so dass 3 Abstufungen in der Wand entstehen. Sie stehen in einem Becken aus Aluminium. Davor liegt eine Betonplatte, rund geschnitten. Die Wand bzw. Becken und Betonplatte werden unterbrochen von dem Eingang zur Tiefgarage. In der Wand sind waagerechte Streifen von unterschiedlicher Höhe und Länge eingemeißelt. Auf der Wand verteilt sind halbkugelförmige Wasserdüsen aus Aluminium. Sie sprühen Wasser in die Höhe an der Wand entlang, das Wasser läuft wieder hinunter in das Becken. 86 Kunstkataster der Stadt Flensburg – Objekte im städtischen Eigentum;, Stand 10.2015: 1 Aluminium-Halbkugel fehlt, nur noch der Wasserhahn vorhanden. An der Wand ist ein brauner Schmutzbelag, dort wo das Wasser hinkommt. Risse an linker Seite unten und rechter Seite oben. Auf den Aluminium-Halbkugeln und im Becken ist der weiße Kalkbelag sehr stark. Leichter Grünbelag im Becken. Die Betonplatte weist Schmutz und Kalkflecken auf. Funktionstüchtig.
63;„Seifenbläser“;;Weiße Marmorskulptur eines kleinen Jungen mit kinnlangem Haar. Er sitzt nach rechts gewandt auf einem zweifach gestuften Marmorsockel, der rechte Arm ist auf den Boden gestützt, die linke Hand hält ein Metallrohr, was er an den Mund geführt hat. Am Ende des Rohrs ist eine Seifenblase aus Glas. Der Junge bläst Seifenblasen. Signatur „H.Weddig“ auf der rückwärtigen Oberseite des Sockels. Die Marmorskulptur mit Sockel ist auf einen neuen schwarzen Marmorsockel, hinter einem Schaufenster aus Glas positioniert. Daneben steht eine Infotafel.;, Stand 10.2015: 2009 restauriert: restaurierte Bruchstellen und Fehlstellen an Finger der linken Hand, linker Oberarm, rechtes Handgelenk, rechter großer Zeh. Die 1. Stufe des Sockels ist in der Mitte gebrochen. Auf dem Sockel sind braune und dunkle Flecken, ein schwarzer Schuhabdruck. Er ist an den Rändern etwas abgestoßen. (Die Rückseite ist nicht sichtbar, da Skulptur nicht zugänglich). Sonstiges: G eschenk des Künstlers an die Stadt 1932 (Brief Archiv Museumsberg). Dauerleihgabe des Museumsbergs an die Diako 2009.
64;Relief Emmi Leisner;B 34,5 x H 57,5 cm;Hochrelief mit Kopf von Emmi Leisner, darunter „Emmi/Leisner/*1885 †1958/Die große Flensburger/Kammersängerin“. Am unteren Tafelrand eingeritzt „Gestiftet: Freundeskreis Emmi Leisner/u. Verschönerungsverein Flensburg 2007“. Signatur rechts unten „H. Oettinger“. Kopf, Name und Titel sind blank golden, Geburts- und Todesjahr sind eingeritzt und treten so in den Hintergrund. Der Hintergrund ist schwarz-braun-golden patiniert.;, Stand 10.2015: Sehr gut.
65;Relief Paul Ziegler;B 34,5 x H 57,5 cm;Hochrelief mit Kopf von Paul Ziegler im Profil nach rechts schauend, darunter „Paul Ziegler/*1874 †1956/Magistratsbaurat in/Flensburg 1910-1939“. Am unteren Tafelrand eingeritzt „2008/Flensburger Baukultur u. Verschönerungsverein Flensburg“ Signatur rechts unten „H. Oettinger“. Kopf, Name und Titel sind blank golden, Geburts- und Todesjahr sind eingeritzt und treten so in den Hintergrund. Der Hintergrund ist schwarz-braun-golden patiniert.;, Stand 10.2015: Sehr gut. Das gesamte Relief ist mit grünen Sprenkeln überzogen, ursprünglich?
67;Skulptur eines Ochsen oder Bullen;83x151 cm, H ca. 119 cm, Sockel: 92x160, H 88 cm;Skulptur eines liegenden Ochsen (oder Bullen) mit kleinen Hörnern, Blick nach vorn Richtung Schulhofmitte. Die Skulptur hat eine schmale Plinthe und ist auf einem Backsteinsockel montiert. Auf der Rückseite der Plinthe Signatur eingemeißelt „Rö“.;, Stand 10.2015: Starker Flechten- und Grünbelag, Vogelkot, kleine Graffitispur, kleine Kratzer. Runde Fehlstelle auf linker Seite (Hinterteil) und zwei auf der rechten Seite. Linkes Horn hat alte Bruchstelle, ist wieder angesetzt worden.
68;Mauer (Kunst am Bau);L 1800 cm, T 60 cm, H 200 cm;Beim Bau der Schule errichtete Betonmauer zwischen den unterschiedlich hohen Schulhöfen. Die Mauer ist mit geometrischen Formen, die durchbrochen und geschlossen sind, verziert. An der Ostseite ist senkrecht die Signatur „J.E. PFOHL FLB. 1968“ teilweise in Spiegelschrift angegeben. Eine Negativform wurde dabei angewendet. Dübel sind an einigen Stellen in der Mauer. Spuren von den Schalungshölzern. Vor der Mauer, auf dem niedriger gelegenen Schulhof sind verschiedene Granitsteine wellenförmig in Terrassen gepflastert. 2 Findlinge ragen aus dem Boden hervor, ein Becken ist mit Beton aufgefüllt. Diese Fläche füllt sich bei Regen mit Wasser (durch 3 Rohre vom höhergelegenen Hof). Laut Artikel Name der Mauer „Die Schallmauer, die auch schon durchbrochen ist“ 96 Kunstkataster der Stadt Flensburg – Objekte im städtischen Eigentum;, Stand 10.2015: Senkrechte und waagerechte große Risse im Beton, kleine Löcher. Große Teile des Betons sind ausgewaschen. Die Signatur ist ausgewaschen, schwer lesbar. In den nächsten Jahren ist eine Sicherung notwendig. Ostseite der Mauer etwas verschmutzt. Kleine Flächen sind mit Farbe beschmiert. Gras- und Unkrautbewuchs im Sockelbereich und im Becken. Eine Stele gehörte laut Schulleitung dazu, fehlt. Laut Zeitungsartikel waren „kurze Baumstämme“ Teil des Beckens. Diese heute nicht mehr zu identifizieren. Die Dübel lassen auf ehemals applizierte Objekte an der Mauer schließen. Becken evtl. später mit Beton zugeschüttet. Heute nicht eindeutig ersichtlich (vgl. Foto, Zeitungsartikel), ob ursprünglich oder später. Sonstiges: V gl. Zeitungsartikel Flensburger Tageblatt, Okt. 1968, Ausst.Kat. Städt. Museum Flensburg 1963.
73;Brunne „Die Welle“;Becken d. 163 cm, Skulptur 94x84 cm, H 63 cm, Sockel 46x56 cm, H 63 cm;Leicht erhöhtes Becken, eingefasst mit Pflastersteinen. Darin auf einem trapezförmigen Dolomitsteinsockel eine Bronzeskulptur in Form einer Welle, die nach vorn rollt. Aus der Unterseite der Welle laufen 4 Wasserstrahlen in das Becken. Durch eine Umwälzpumpe wird das Wasser wieder in den Brunnenschacht befördert. Am Sockel Plakette mit Inschrift „Uwe Appold/Die Welle/(1987)“. Auf der Rückseite ist eine Stahlplatte angebracht, die den Sockel mit der Skulptur verbindet. 99 Kunstkataster der Stadt Flensburg – Objekte im städtischen Eigentum „Der Entwurf orientiert sich an der Geschichte des St. Jürgen Viertels. Hier wohnten einst Fischer und Seeleute, deren Leben durch Wellengang auf See bestimmt wurde.“ (U. Appold);, Stand 10.2015: Das Wasser spritzt über das Becken, der Platz darum ist nass. Becken: Grünbelag, etwas Laub, sonst in Ordnung. Sockel: Starker Grünbelag, Bronzespuren von Skulptur, Rostbelag. Die Plakette ist schmutzig und rostig. Eine Reinigung ist erforderlich. Skulptur: 1 Wasserdüse ist verstopft bzw. läuft kein Wasser mehr hinaus, daher spritzt das Wasser außerhalb des Beckens. Leichte Farbspuren, Vogelkot. Grünbelag und Rost vor allem an der Unterseite. Grüne Patina. Sonstiges: Die Anwohner reinigen den Brunnen von Laub, damit er nicht überläuft bzw. rufen das TBZ, wenn eine Reinigung notwendig ist. Durch Bürgerinitiative (Verein zur Erhaltung der östlichen Altstadt?) in Auftrag gegeben. Siehe Infomappe U. Appold.
76;Technisches Denkmal: Nockenwelle;L 469 cm, T ca. 70 cm, H ca. 106 cm;Nockenwelle aus einem Schiffdieselmotor, auf zwei Betonpfeilern vor einem Silo errichtet. Parallel zu den plastischen Elementen wurde ein Farb- und Gestaltungskonzept entwickelt, das in Zusammenarbeit mit dem Städtischen Hochbauamt der Stadt Flensburg realisiert wurde (laut Infomappe U. Appold).;, Stand 10.2015: Gut. Etwas Vogelkot, leichter Grünbelag, kleine Roststellen.
83;Grenzstein Flensburg – Harrislee;42x42 cm, H 154 cm;Stele mit kurzen Strichen als Meißelspuren, auf jeder Seite zwei senkrecht geteilte konkave Flächen. Im unteren Bereich schräg verlaufende unbehauene Wellen, die das Wasser symbolisieren. Von Pflastersteinen eingefasst. Auf der einen Seite (Richtung Flensburg) waagerecht im oberen Drittel „Flensburg“, darunter im linken Fach zwei Löwen, im rechten Fach die Burg, über „Flensburg“ im rechten Fach stilisiertes Nesselblatt. Die Darstellung ergibt zusammen das Flensburger Wappen. Auf der anderen Seite „Harrislee“ (Richtung Wassersleben) auf derselben Höhe wie „Flensburg“, sonst leer. Die zwei übrigen Seiten haben keine Inschriften. 103 Kunstkataster der Stadt Flensburg – Objekte im städtischen Eigentum;, Stand 10.2015: Starker Grünbelag, besonders im unteren Bereich. Im Stein Löcher, sehr porös, besonders auf der Oberseite. Vogelkot. Sonstiges: 1989 von Steinmetzin Karen Peschke als Meisterstück gefertigt. Der Stein soll Gemeinschaft symbolisieren.
88;Glasfenster „Stadtplan“;B 560 cm, H 230 cm (nur Glasmotiv);In eine weiße Betonmauer ist ein Glasrelief eingelassen. Die Mauer trennt den Schulhof vom Außenbereich. Das Relief besteht aus buntem Glas mit schwarz gemalter Betoneinfassung. Die Fassung ist ebenfalls Gestaltungsmittel, zusammen mit dem bunten Glas sind geometrische, eckige und halbrunde Formen dargestellt. „Goldene Keile, die von den rot um die blaue Förde wiedergegebenen, bebauten Flächen ausgehen oder auf sie zuführen, bezeichnen die Haupteinzugs- oder Ausstrahlungsbahnen des Verkehrs, des pulsierenden Lebens in der Stadt. Durch die nur nach künstlerischen Prinzipien gezogenen Konturen dieses Stadtplanes 105 Kunstkataster der Stadt Flensburg – Objekte im städtischen Eigentum wirken größere Flächen der Betonwand bewußt nüchtern und kalt.“ (aus Redlefsen, Ellen: E.G. Hansing in Schleswig-Holstein, Schleswig 1979);, Stand 10.2015: Betonmauer: Putz fällt ab, sehr verschmutzt. Glasrelief: Weiße Farbe auf schwarzer Einfassung vom Bemalen der Betonmauer. Schwarze Farbe der Einfassung ist überall abgerieben. Glas ist an vielen Stellen gesprungen oder abgeplatzt. Einige Kratzer. Ein großer Riss an der Seite der Betoneinfassung führt dazu, dass zwischen Glas und Einfassung eine kleine Lücke klafft, die dringend geschlossen werden sollte. Sonstiges: Zusammenarbeit mit Glaserei Günter Kruse, Flensburg
91;Glasfenster;L 975 x H 75 cm;13 Betonwaben sind mit Glasflächen in Grün, Blau, Weiß und durchsichtig mit Draht und Bleistegen verziert, so dass ein Schattenspiel und Dreidimensionalität entsteht. Ausgeführt durch Glaserei Kruse, Flensburg. Die Glasflächen liegen in Augenhöhe als horizontales Band nebeneinander, in zwei Teile unterbrochen von einer Ausgangstür in den Hof. Der linke Teil besteht aus farbigen Glasflächen und –brocken mit unterschiedlichen lila, grünen und gelben Farbtönen. In der Mitte steht eine aus schwarzem Metall geformte abstrakte Menschengruppe. Der rechte Teil besteht aus drei weiß-milchigen Glasflächen mit dunklen, aus Draht geformten Linien und Knoten. Konzipiert für die Eingangshalle in dem Erweiterungsbau der ehemaligen Staatlichen Bildungsanstalt für Frauenberufe (heute Technisches Rathaus I).;, Stand 10.2015: Staubig, Fliegenkot, etwas Schmutz. Farbspritzer auf einigen Glasflächen. Zum Teil durch Möbel verstellt. Sonstiges: Auftrag der Stadt Flensburg. Literatur: Ekkehard Thieme, Kunst im öffentlichen Raum, hrsg. Von Peter Nicolaisen in Verbindung mit dem Kunstverein Flensburg, Flensburg 2002, S. 23-30
98;Sgraffito;L 300 x H 200 cm;Landschaftsdarstellung mit Hafen, Segelbooten, Häusern, Kirche, Strand, Leuchtturm von Swinemünde in Farbe auf weißen Putz gemalt, Details mit bunten Stein in Mosaik gefertigt. Im Bild links Mosaik „Swinemünde“, darunter Wappen aus bunten Mosaiksteinen. Im grauen Stahlrahmen aufgehängt. 110 Kunstkataster der Stadt Flensburg – Objekte im städtischen Eigentum;, Stand 09.2015: Kleine Dellen, Schmutzflecke und Kratzer. Der Putz ist an manchen Stellen gerissen. Ein sehr langer horizontaler Riss führt über dem Swinemünde-Schriftzug bis in die Mitte des Bildes entlang. Putzausbruch im Bereich eines Fischerbootes, der dringend gesichert werden sollte, um größeren Schaden zu vermeiden. Sonstiges: F lensburg ist Patenstadt für die Swinemünder, die 1945ff. aus der pommerschen Stadt flohen oder vertrieben wurden.
99;Sgraffito „Flensburg, Hafenpanorama“;;Großformatiges Sgraffito des Flensburger Hafenpanoramas, gesehen von der Ostseite. Im Vordergrund Fischer und Fischerboote am Hofenostufer.;, Stand 09.2015: Von Restaurator Marek Filipiak fachgerecht ausgebaut, in Einzelstücke zerlegt und eingelagert.
21;Sgraffito;;Sgraffito des Flensburger Kaufmannshofes Holm 19/21, gesehen von Osten.;, Stand 09.2015: Von Restaurator Marek Filipiak fachgerecht ausgebaut, in Einzelstücke zerlegt und eingelagert. Sonstiges: L agerort zur Zeit nicht bekannt (TBZ)
106;Relief Mittelpunkt der Stadt Flensburg;d. 39 cm, Granitstein: L 26/14 x H 16,5 cm;In den Boden eingelassenes rundes Bronzerelief mit Ritzungen und kreisförmiger Vertiefung in der Mitte, die nach links und unten in einer Linie ausläuft. Links oben ist dazugehörig ein roter Granitstein bossiert und mit Inschrift „Mittelpunkt der Stadt Flensburg“ in den Boden eingelassen. Die Skulptur soll an die zentrale Lage des ehemaligen mittelalterlichen Thingplatzes der Stadt erinnern, der sich ungefähr an der Stelle befand. Die Idee dazu hatte Marianne Schreckenberger. Dietmar Gördes ist Absolvent der Werkkunstschule Flensburg (1988). 114 Kunstkataster der Stadt Flensburg – Objekte im städtischen Eigentum;, Stand 10.2015: Bronzerelief: Kaugummifleck, stark abgerieben, etwas grüne Patina. Granitstein: wenig Verschmutzung, sonst gut lesbar. Einbetonierung ist gerissen, aber in Ordnung.
107;Skulptur „Paar“;Figur 17x27 cm, Platte 23x32 cm, H 66/168 cm (ohne/mit Sockel);Abstraktes Abbild eines Paares, auf einem Betonsockel montiert.;, Stand 09.2015: Infotafel verblasst. 3 von 4 Schrauben abgebrochen mit denen die Platte auf den Sockel montiert ist. Farbfleck und Vogelkot auf der Platte und der Figur. Kleine Kratzer an einigen Stellen. Betonsockel: einige Fehlstellen, Grünbelag durch Bronzeplatte (erwünscht).
108;Skulptur „Schwimmer“;B 40, T 5, H 198;Flache Stele aus rostendem Eisenguss. Im oberen Bereich T-förmiger Ausschnitt mit je 1 von einem kleinen Podest springenden Figur.;, Stand 09.2015: Keine Infotafel. Ist laut KIS (Frau Stappert) ist aber eine Bronzeplakette vorhanden, die bald montiert wird. Schmutz im unteren Bereich. Abreibungen an einigen Stellen (im Bereich der Figuren), so dass blankes Metall zu sehen ist.
109;Skulptur „Paar“ (Mann und Hund);30x20 cm, H 148 cm;Mann und Hund auf einem Sockel, alles aus einem Block (Dalbe) geschnitzt. Das Holz ist evtl. geweißt? Die Augen von Mann und Hund sind aus weißgefärbten Holz eingelassen. Nicht sichtbarer Eisensockel im Boden.;, Stand 09.2015: Infotafel ist verrostet. Holzspliss an der Vorder- und rechten Seite. Kaum Grünbefall. Holz an der rechten hinteren Ecke abgerieben (durch Reinigung?)
110;Skulptur „Eine Richtung“;B 40, T 20 cm, H 208/235 cm (ohne/mit Sockel);Mann und Frau sind nebeneinander aus einem Stück Holz geschnitzt, auf Betonsockel montiert. Die Frau trägt ein langes rotes Kleid, der Mann Hose, Sakko in Blau, weißes Hemd. Die Haare wehen nach links und verschmelzen miteinander.;, Stand 09.2015: Farbabplatzungen an vielen Stellen der Skulptur, besonders an der Wasser/Windseite. Grünbelag im unteren Bereich. Risse an der Vorderseite und zwischen den Haaren. Großer Riss an der Rückseite. Sockel mit wenig Grünbelag.
111;Skulptur „Oh du mein Herz“;30x30 cm, H 168 cm;Stele mit einem Paar als Bekrönung. Das Paar, links Mann, rechts Frau, umarmt sich und hält sich die Hand. Die Köpfe sind zueinander geneigt. Auf der Vorderseite ist der Titel „OH DU MEIN HERZ“, auf der linken Seite „2010“ und auf der rechten Seite „A. VON HIPPEL“ eingraviert.;, Stand 09.2015: Geringer Moos- und Grünbefall. Keine Infotafel (bewusst von Kultur-Initiative Sonwik weggelassen).
112;Skulptur „Hand III“;B 52, T 47, H 136/200 cm (ohne/mit Sockel);Eine Hand ist auf einem Betonsockel mit einer Kupferplatte befestigt. Die Hand hält den Ring- und kleinen Finger hoch. Laut Künstler frei nach Christi segnender Hand.;, Stand 09.2015: Keine Infotafel. Ist laut KIS (Frau Stappert) in Arbeit. Unterseite der Holzschicht blättert ab, ist aber kaum ersichtlich. Einzelne Bleibleche stehen ab. Betonsockel: Rostflecken von Kupferplatte, leichte Risse im Beton, Grünbelag.
113;Skulptur „Begegnung mit der anderen Art“, zweiteilig;?;Nashorn-Figur auf Stele, Elefanten-Figur auf Stele. Beide stehen einander leicht versetzt gegenüber und schauen sich an.;, Stand 09.2015: Keine Mängel.
118;Windspiel und Wasserlauf Phänomenta;;Treppenförmiger Wasserlauf (Kaskade) aus rostendem Stahl führt von Phänomenta zum Hafen. Auf der Hafenseite ist der Bachlauf durch Bodenplatten aus rostendem Stahl angedeutet. Er endet mit einem Windspiel. Das Windspiel besteht aus einem rostenden Stahlgerüst mit 2x10 senkrecht angebrachten Platten aus Blech oder Aluminium. Auf der Stadtseite steht auf jeder Platte ein Buchstabe und formt „Phänomenta“. Zur Hafenseite formen die Platten „Flensburg“. Die einzelnen Platten bewegen sich im Wind in unterschiedliche Richtungen. Darunter sind 4 Scheinwerfer zur Beleuchtung angebracht. 130 Kunstkataster der Stadt Flensburg – Objekte im städtischen Eigentum;, Stand 10.2015: Die Platten mit den Buchstaben O und B fehlen. Auf einigen Platten befinden sich Kritzeleien und Aufkleber. Am Gerüst kleine Graffiti 1 Scheinwerferglas zerstört. Sind Scheinwerfer noch funktionstüchtig? Der Wasserlauf weist Grünbelag auf.
120;Brunnen;d. 124 cm, H 177 cm;Brunnen mit polygonalem, ziselierten Becken. Säule in der Mitte des Beckens mit Kanneluren und einer Schale oben auf. Von der Schale lief ehemals das Wasser in das Becken. Auf der Schale sind die 12 Tierkreiszeichen dargestellt. Der Brunnen steht auf einem Granitsockel, der wohl nicht ursprünglich ist. Am Becken ist eine kleine Blechtafel angebracht mit Inschrift „Gestiftet Brinkmeiers Hotel“ (Das Hotel befand sich ehemals im Gebäude Rathausstraße 10).;, Stand 10.2015: Nicht funktionstüchtig. Obere Öffnung in der Schale mit Deckel geschlossen, Ablauf im Becken ist verstopft. Moos- und Grünbelag, Laub im Becken, Löcher und poröse Stellen im Stein. Die Stiftertafel ist verschmutzt, aber noch lesbar.
123;Skulpturen-Sockel;d. 54 cm, H 68 cm;Polygonaler, achteckiger Sockel aus weißem Stein, mehrfach abgestuft. Auf der Sockelplatte sind in der Mitte Reste einer Befestigung vorhanden. Unbekannte Herkunft.;, Stand 10.2015: Grünbelag, Löcher und abgeplatzte Stellen im Stein.
124;Froschbrunnen;Frosch 130x112 cm, H 85 cm;Die Einfassung des Brunnens war Teil des ehemaligen Germania-Brunnens von 1903 am Südermarkt. Die Germania wurde 1933 demontiert, das Becken mit der Einfassung blieb und wurde Ende der 1950er in den Carlisle-Park versetzt. Als Brunnenfigur dient ein sitzender Frosch, der mit den Augen Richtung Bahnhof blickt. Sein Mund ist mit Blech ausgelegt, (ehemals wasserspeiend?) Aus Düsen um die Einfassung herum spritzt Wasser in Bögen in die Mitte des Beckens. 136 Kunstkataster der Stadt Flensburg – Objekte im städtischen Eigentum;, Stand 10.2015: Der Brunnen ist funktionstüchtig. Frosch: Blaue Farbreste an Augen, starker Moos- und Grünbelag. Türkise Farbspritzer auf dem Sockel und dem Frosch von Bemalung des Beckens und der Wasserdüsen. Der Stein ist sehr ausgewaschen, Risse an Kopf und Hinterteil. Einfassung: etwas Grünbelag, Betonfugen rissig und mit Fehlstellen.
126;Ulmen-Skulptur;55x50 cm, H 178 cm;Letzte verbliebene Ulmenskulptur der Gruppe Kunst-Werk-Statt-Rote Laterne e.V., die aus kranken, gefällten Ulmen zwischen 1998 und 2001 entstanden. Ein Kopf eines Kindes durchbricht die Baumstammmitte. Darunter sind zwei Hände zu sehen, die den Stamm von Innen nach Außen umgreifen. Eine Infotafel ist in näherer Umgebung aufgestellt.;, Stand 10.2015: Stark beschädigt durch Wurmbefall. Ausbrüche an der Rückseite und im oberen Bereich, so dass der obere Teil der Skulptur nicht mehr erkennbar ist.
127;Wandmalerei;;Geometrische Linien in Farbe gestalten eine Längsseite der Turnhallenwand und kleine Flächen der Seitenfassaden. Ein hellblau-grünes Band beginnt im Norden, wird an der Langsseite zu einem Dreieck aus hellblau, grün, rosa, dunkelblau. Darauf folgen zwei hochrechteckige dunkel- und hellblaue Flächen und an der Seitenfassade zwei diagonale rosa und dunkelblaue Streifen. Die Zwischenräume sind schwarz-braune Fassade.;, Stand 10.2015: Starker Farbabrieb, daher ursprüngliche Farbnuancen nicht mehr nachvollziehbar. An linker Seite einzelne dunkle Pinselstriche.
131;Kunst am Bau, Uhr und Relief;;Zweiteiliges Ornament aus Draht. Die Konturen eines Pferdes und eines Hahnes sind aus Draht geformt, ebenso ein einzelner Vogel (Möwe?). Zum Teil sind die Flächen durch Drahtgeflecht gefüllt. Dazu in gleicher Art eine Uhr.;, Stand 10.2015: Uhr funktionstüchtig. Ornament im guten Zustand.
